Description,Tag
Acute Venous Thromboembolism; Acute Venous Thrombosis; American Venous Forum; Central venous pathology; Deep vein Thrombosis; Deep vein thrombosis; Deep venous pathology; Deep venous surgery; Giacomini vein; Handbook of venous and lymphatic disorders; IVC; IVC access; IVC anomalies; IVC filter; IVC filters; IVC injuries; IVC injury; Pelvic venous disorders; Post-venous intervention; Preoperative saphenous vein mapping; Recurrent central venous pathology; Saphenous ablation; Saphenous vein reconstruction; Superficial vein thrombosis; Superficial venous incompetence; Superficial venous surgery; Ulcer; Ulcer recurrence; VENOUS; Vein bypass grafts; Venous Thromboembolism; Venous Thrombosis; Venous anomalies; Venous events; Venous intervention; Venous leg ulceration; Venous outflow stenosis; Venous preservation; Venous thromboembolic diseases; Venous thromboembolism; Venous ulceration; abdominal venous injury; above knee venous bypass; accessory saphenous veins; active venous leg ulceration; acute deep vein thrombosis; acute deep venous thrombosis; acute superficial venous intervention; acute venous thromboembolism; acute venous thrombosis; adequate venous diameter; antecubital vein; anterior accessory saphenous vein; arm/spliced vein bypass; arterial and venous phases; arterial and venous system; arterial venous haemorrhage; asymptomatic deep vein thrombosis; autogeneous vein; autogenous vein; autogenous vein bypass grafting; autogenous vein graft; autogenous vein grafts; autologous femoral vein; autologous saphenous vein; autologous vein; autologous vein bypass; autologous vein conduit; autologous vein graft; autologous vein grafts; autologous vein interposition; autologous vein patch; autologous venous reconstruction; axial deep venous incompetence; basilic vein; basilic vein transposition; blocked deep vein; blunt isolated IVC injuries; calf deep vein thrombosis; calf vein thrombosis; cancer associated venous thrombosis; central vein stenosis; central venous; central venous access; central venous catheters; central venous hypertension; central venous lesions; central venous lines; central venous occlusive disease; central venous outflow; central venous stenosis; cephalic vein; cephalic vein mapping; cephalic venous diameter; chronic deep venous obstruction; common femoral vein; common iliac vein; complex venous injuries; congenital venous malformation; congenital venous malformations; damage to vein; deep femoral vein; deep vein; deep vein disease; deep vein obstruction; deep vein reflux; deep vein thrombosis; deep vein thrombosis prophylaxis; deep venous disease; deep venous event; deep venous incompetence; deep venous insufficiency; deep venous interventions; deep venous obstruction; deep venous pathology; deep venous procedures; deep venous stenting; deep venous system; deep venous thrombosis; deep-vein thrombosis; diabetic foot ulcer; disabling venous claudication; distal deep vein thrombosis; distal deep venous thrombosis; distal venous bypasses; distal venous hypertension; doubled vein graft; early endo-venous reflux ablation; elevated venous pressures; external iliac vein; external jugular vein; femoral vein; femoropopliteal vein bypasses; filtre IVC; first venous thrombosis; foot ulcer; gas in portal vein; gas in the portal vein; global venous incompetence; gonadal vein; gonadal vein reflux; great saphenous vein; great saphenous vein incompetence; healed venous leg; healed venous leg ulceration; heel ulcer excision; high grade vein graft stenosis; hybrid deep venous reconstruction; idiopathic deep venous thrombosis; idiopathic venous thromboembolism; iliac vein; iliac vein injury; iliac vein outflow obstruction; iliac vein patency; iliac vein rupture; iliac vein stenting; iliac venous imaging; iliofemoral vein obstruction; iliofemoral venous obstruction; incompetent great saphenous vein; incompetent saphenous veins; infrainguinal vein bypass; infrainguinal vein bypass graft; internal iliac vein; internal jugular vein; intersaphenous vein; ipsilateral saphenous vein transposition; jugular vein turndown; jugular venous access; late deep venous insufficiency; left common iliac vein; leg ulcer; lower extremity vein grafts; mixed ulcer; modern IVC filters; non-saphenous reflux; non-thrombotic iliac vein lesion; non-venous causes; open vein bypass; outflow vein dilatation; ovarian vein; pelvic vein; pelvic vein embolisation; pelvic vein incompetence; pelvic vein reflux; pelvic venous congestion; pelvic venous disorders; pelvic venous hypertension; pelvic venous incompetence; penetrating atherosclerotic ulcer; perforating vein; perforating vein incompetence; peri-venous tumescent solution; pharmacologic venous thromboembolic prophylaxis; popliteal vein; portal vein; portal venous phase; portal venous phase imaging; portal venous systems; posterior accessory saphenous vein; pre-operative vein mapping; provoked deep vein thrombosis; provoked venous thromboembolism; proximal deep vein thrombosis; proximal-vein thrombosis; recalcitrant venous ulcer; recurrent deep vein thrombosis; recurrent venous thromboembolism; recurrent venous thrombosis; reduce venous symptoms; residual vein obstruction; reversed vein graft; reversed vein grafts; revised Venous Clinical Severity Score; saphenous ablation; saphenous trunk; saphenous trunk incompetence; saphenous trunks; saphenous vein; saphenous vein ablation; saphenous vein bypass; saphenous vein incompetence; saphenous veins; sciatic vein incompetence; small saphenous vein; splanchnic vein thrombosis; splenic vein; sub-ulcer venous plexus; sub-ulcer venous plexus ablation; subclavian vein; superficial epigastric vein; superficial external pudendal vein; superficial vein; superficial vein thrombosis; superficial venous; superficial venous ablation procedures; superficial venous disease; superficial venous incompetence; superficial venous intervention; superficial venous interventions; superficial venous materials; superficial venous reflux; superficial venous thrombosis; superficial-vein thrombosis; surgical deep venous reconstruction; symptomatic central venous outflow disease; target vein; testicular vein; testicular vein reflux; thrombosed vein; titanium venous window needle guide; translocated autogenous vein; transposed basilic vein; truncal vein ablation; tunnelled cuffed central venous catheters; ulcer; ulcer free rates; ulcer healing; ulcer recurrence; ulcer size; ultrasound vein mapping; underlying venous problem; unprovoked deep vein thrombosis; unprovoked proximal deep vein thrombosis; unprovoked venous thromboembolism; vein; vein and nerve injuries; vein bypass; vein bypass grafts; vein bypasses; vein conduit; vein diameters; vein graft; vein graft failure; vein graft patency; vein graft stenosis; vein grafts; vein injuries; vein ligation; vein occlusion; vein size; vein size reduction; vein transposition; vein wall scarification; vein walls; vein-graft failure; venous; venous access; venous anastomosis; venous anatomy; venous aneurysm; venous claudication; venous clinical severity score; venous clinics; venous collateral drainage; venous compression; venous conduit; venous diameters; venous disease; venous diseases; venous distention; venous drainage; venous drainage index; venous duplex ultrasound; venous edema; venous embolisation; venous filling index; venous graft; venous grafts; venous haemodynamics; venous hypertension; venous incompetence; venous indication; venous injuries; venous injury; venous insufficiency; venous insufficiency.; venous intervention; venous interventions; venous leg ulcer; venous leg ulceration; venous leg ulcers; venous ligation; venous malformation; venous mapping; venous morbidity; venous morphology; venous needle; venous obstruction; venous oedema; venous origin; venous outcomes; venous outflow; venous outflow obstruction; venous outflow obstructions; venous outflow stenoses; venous outflow stenosis; venous pathology; venous phase; venous phases; venous preservation; venous pressure; venous reconstruction; venous reflux; venous reflux elimination; venous registries; venous repair; venous return; venous segment; venous stasis; venous stenosis; venous stent obstruction; venous stenting; venous symptoms; venous system; venous thoracic; venous thoracic outlet syndrome; venous thromboembolic event; venous thromboembolic events; venous thromboembolic treatment; venous thromboembolism; venous thromboprophylaxis; venous thrombosis; venous thrombus; venous tone; venous tourniquet; venous transposition; venous ulceration; venous ulcers; venous valves; Autologous vein reconstruction; Calf deep vein thrombosis; Deep venous thrombosis; Deep-vein thrombosis; Endovascular venous thrombolysis; Penetrating atherosclerotic ulcer; Perforating vein ablation; Perforating vein fistula; Perforating vein incompetence; Perforating vein ligation; Popliteal venous entrapment; Superficial vein ablation; Treatment of mixed venous and arterial ulcers; Upper extremity deep vein thrombosis; Vein grafts; Venous access; acute lower limb deep venous thrombosis; basilic vein fistula; cancer-associated venous thromboembolism; cervical venous injury; combined superficial and deep venous pathology; complex central venous catheters; costoclavicular venous decompression; iliofemoral venous stenting; incompetent saphenous trunk; isolated lower limb superficial vein thrombosis; lower limb superficial vein thrombosis; penetrating atherosclerotic ulcer disease; peripherally inserted central venous catheters; popliteal vein aneurysm; provoked proximal deep vein thrombosis; superficial vein ablation; supra-inguinal venous obstruction; suspected lower limb superficial vein thrombosis; symptomatic calf deep vein thrombosis; upper arm cephalic vein; venous hemodynamic changes; venous surgery,anatomy.venous.general
Acute bleeding; Bleeding Academic Research Consortium; Improve Bleeding Score; Risk stratification for bleeding; Severe bleeding; Stop bleeding; abnormal bleeding times; active bleeding; actively bleeding; acute bleeding; acute major bleeding; acute spontaneous bleeding; bleeding; bleeding aortoenteric fistulas; bleeding complications; bleeding concerns; bleeding control; bleeding definitions; bleeding episodes; bleeding events; bleeding injury; bleeding rates; bleeding risk; bleeding risk assessment; bleeding risk stratification; bleeding risks; bleeding tendency; bleeding times; bleeding trauma; cessation of bleeding; clinically relevant bleeding; clinically relevant non-major bleeding; control bleeding; excessive bleeding; external bleeding; gastrointestinal bleeding; genitourinary bleeding; herald bleeding; high risk of bleeding; increased bleeding risk; intra-operative bleeding; life threatening bleeding; low bleeding risk; major bleeding; major bleeding complications; major bleeding events; major bleeding rate; major bleeding risk; major bleeding risks; massive bleeding; massive retroperitoneal bleeding; minor bleeding; moderate bleeding risk; non-major bleeding; non-major bleeding rates; not actively bleeding; ongoing bleeding; peri-operative bleeding; persistent bleeding; post-cannulation bleeding; post-operative bleeding; prevent recurrent bleeding; prior bleeding; quantification of bleeding; risk of bleeding; risks of bleeding; rupture bleeding; serious bleeding; severe bleeding; subdural bleeding; symptomatic bleeding; uncontrolled bleeding; validated bleeding risk scores; Acute Gastrointestinal Bleeding; bleeding management; bleeding rate; major bleeding rates; management of bleeding; upper gastrointestinal bleeding,clinical.complication.bleeding
Aneurysm; Aneurysm sac growth; Aneurysm size; Aneurysm syndromes; Pancreaticoduodenal artery aneurysm; Para-anastomotic aneurysm; Splenic artery aneurysm; Thoraco-abdominal aneurysm; Women's Aneurysm Research; aneurysm; aneurysm anatomy; aneurysm characteristics; aneurysm diameter; aneurysm dimension; aneurysm disease; aneurysm endpoints; aneurysm exclusion; aneurysm formation; aneurysm growth; aneurysm management; aneurysm recanalisation; aneurysm related; aneurysm repair; aneurysm rupture; aneurysm sac; aneurysm sac expansion; aneurysm sac growth; aneurysm size; aneurysm.; asymptomatic visceral artery aneurysm; degenerative aneurysm; distal arch aneurysm; familial aneurysm disorder; hepatic artery aneurysm; isolated aneurysm; maximum aneurysm diameter; mycotic abdominal aneurysm; mycotic aneurysm; mycotic visceral artery aneurysm; non-selective aneurysm sac embolisation; open visceral artery aneurysm repair; pancreaticoduodenal artery aneurysm; para-anastomotic aneurysm; para-anastomotic aneurysm formation; persistent aneurysm sac growth; post-dissection aneurysm; prevent aneurysm development; prophylactic aneurysm repair; pseudo-aneurysm; rapid aneurysm enlargement; significant aneurysm; significant aneurysm sac growth; small aneurysm; small aneurysm group; splenic artery aneurysm; symptomatic aneurysm; symptomatic non-ruptured aneurysm; symptomatic visceral artery aneurysm; thoracic aneurysm; thoraco-abdominal aneurysm; thoracoabdominal aneurysm; visceral artery aneurysm; Hepatic artery aneurysm; Ruptured aneurysm; Visceral artery aneurysm; non-infectious para-anastomotic aneurysm,clinical.condition.aneurysm
CA dissection; Cervical Artery Dissection; IMH; PAU; PAu; acute dissection; acute intramural hematoma; acute non-A-non-B dissection; acute type A dissection; arterial dissection; asymptomatic dissection; cervical artery dissection; chronic dissection; complicated PAU; dissection; dissection rates; dissection resolution; dissection types; extracranial artery dissection; intracranial artery dissection; intramural hematoma; isolated arterial dissection; isolated dissection; nonA-nonB DISSECTION; progression of dissection; recurrent dissection; residual dissection; retrograde dissection; ruptured dissection; spontaneous dissection; spontaneous isolated dissection; sub-acute dissection; surgical dissection; symptomatic isolated dissection; type A dissection; Dissection; Intramural hematoma; dissection onset; uncomplicated IMH,clinical.condition.dissection
American Association for the Surgery of Trauma; Blunt trauma; British major trauma centre; Bull Emerg Trauma; Committee on Trauma; Complete wall injury; Deceleration trauma; Eastern Association for the Surgery of Trauma; Extremity vascular trauma; Focused Assessment with Sonography for Trauma; Focused Assessment with Sonography in Trauma; Iatrogenic lesions; Injury; Injury 2022; Ischemia Reperfusion Injury; Israeli Trauma Group; J Trauma; J Trauma Acute Care Surg; National Trauma Data Bank; National Trauma Databank; Partial wall injury; Penetrating cervical vascular injury; Traumatic brain injury; US Trauma Quality Improvement Program; VASCULAR TRAUMA; Vascular injury; Vascular trauma; Western Trauma Association; abdominal trauma; acute kidney injury; acute vascular trauma care; adult vascular trauma; arterial injury; arterial trauma; below-the-knee vascular injury; blood vessel injury; blunt; blunt cerebrovascular injury; blunt cervical vascular injury; blunt extremity injuries; blunt mechanism; blunt neck trauma; blunt needles; blunt thoracic; blunt thoracic outlet arterial injuries; blunt trauma; blunt traumatic; bowel injury; cerebrovascular artery injury; cerebrovascular injury; cervical vascular injury; civilian trauma; civilian vascular trauma; complex extremity trauma; complex extremity vascular trauma; concomitant injury; contrast induced acute kidney injury; contrast induced kidney injury; degree of trauma; exsanguinating injury; extremity injury; extremity trauma; extremity vascular injury; extremity vascular trauma; firearm injury; high impact trauma; high risk injury features; high volume trauma centre; iatrogenic; iatrogenic arterial injuries; inferior vena cava injury; infragenicular arterial injury; injury; injury complexity; injury pattern; injury severity; injury statistics; intestinal injury; intimal injury; ischaemic intestinal injury; level 1 trauma centre; limb injury; local trauma; major limb trauma; major trauma; major vascular injury; management of penetrating trauma; managing vascular trauma; massive burn injury; modern trauma care; multidisciplinary trauma teams; myocardial injury; neck trauma; nerve injury; neurologic injury; neurological injury; non-compressible torso trauma; paediatric vascular trauma; pancreatic injury; pediatric vascular injury; pediatric vascular trauma; pelvic injury; pelvic trauma; penetrating; penetrating cervical vascular injury; penetrating extremity injury; penetrating extremity trauma; penetrating extremity vascular trauma; penetrating injuries; penetrating lower extremity arterial trauma; penetrating mechanism; penetrating mechanisms; penetrating neck injury; penetrating neck trauma; penetrating trauma; peripheral arterial injury; peripheral vascular injury; peripheral vascular trauma; phrenic nerve injury; postoperative neurological injury; regional trauma centralisation; regional trauma system; reperfusion injury; risk of nerve injury; severe injury grades; severe trauma; severe traumatic brain injury; significant vascular injury; spinal cord injury; sural nerve injury; thoracic arterial injury; tissue injury; trauma; trauma call; trauma care; trauma center; trauma centre; trauma centres; trauma imaging; trauma induced coagulopathy; trauma laparotomy; trauma management; trauma patient; trauma population; trauma sciences; trauma setting; trauma surgeons; trauma surgery; trauma team; trauma vascular; traumatic brain injury; traumatic injury; vascular injury; vascular injury management; vascular trauma; vascular trauma management; vessel injury; vessel injury repair; visceral artery injury; wall injury; wartime vascular trauma; whole-body trauma imaging; Advanced Trauma Life Support; Blunt cervical vascular injury; Cranial nerve injury; EXTREMITY VASCULAR TRAUMA; NECK VASCULAR TRAUMA; Orthopaedic injury; Penetrating vascular trauma; Trauma; abdominal vascular injury; abdominal vascular trauma; blunt injuries; penetrating cervical vascular injuries; penetrating thoracic trauma; regional trauma centralization; trauma care systems; trauma deaths; trauma research; vascular trauma surgery,clinical.condition.trauma
".035"" hydrophilic guide wire; 0.68; 1.1; 1.2.3; 1.2.4; 1.2.5.631; 1.42; 1.83; 1.96; 10.5; hydrophilic guidewire; hydrophilic wire; over the wire embolectomy; pressure wire",clinical.device.accessory
Arteriovenous graft; Dacron; ENDOGRAFT; Endograft; Endograft Infections; GRAFT; Graft; Graft explantation; Graft material; Graft occlusion; Graft porosity; PTFE; PTFE graft; VA prosthetic graft; Vascular Graft Infections; arteriovenous graft; autologous graft material; bifurcated graft; biological graft; biological graft material; branched/fenestrated endograft; chimney graft; choice of graft; complete graft explantation; dacron; ePTFE graft; endograft; endograft complications; endograft coverage; first choice graft material; graft; graft configuration; graft designs; graft elongation; graft enteric fistula; graft excision; graft explantation; graft failure; graft failures; graft formation; graft implantation; graft incorporation; graft infections; graft infectivity; graft integrity; graft interposition; graft kinking; graft material; graft materials; graft obstruction; graft occlusion; graft occlusions; graft porosity; graft preservation; graft related complications; graft related intervention; graft related problems; graft removal; graft repair; graft revision; graft rupture; graft salvage; graft sizes; graft thrombosis; harvested graft material; ideal graft materials; infected graft; infected graft material; infected graft outcomes; infected graft removal; infected vascular graft; interposition graft; low graft flow; old graft; optimal ISR graft; parallel graft techniques; partial graft; partial graft excision; partial graft removal; partial graft resection; peri-graft fluid; peri-graft fluid collections; peripheral graft infections; physician modified endograft; primary graft; prosthetic graft; prosthetic graft infections; prosthetic vascular graft; prosthetic vascular graft infections; recurrent graft infections; scallop-designed endograft; self-sealing arteriovenous graft; skin graft; skin graft necrosis; surgical graft; synthetic graft; synthetic graft material; synthetic interposition graft; synthetic vascular graft; thoracic graft; thoracic vascular graft; thoraco-abdominal vascular graft; total graft; total graft excision; total graft explantation; vascular graft; vascular graft infections; Late dacron patch; Prosthetic arterial graft; Prosthetic vascular graft infections; Synthetic graft material; Thoracic vascular graft; arteriovenous graft thrombosis; graft stenosis; parallel graft technique; peripheral vascular graft; surgical graft revisions; vascular graft reconstruction,clinical.device.graft
