Description,Tag
2013 Recommendations; BMT recommendations; CEAP clinical class C2s; CEAP clinical class C3; CEAP clinical class C4b; Class 1; Class B; Class HIa; Class I; Class I C; Class I recommendations; Class II; Class II recommendations; Class III; Class IIIa; Class IIIa recommendations; Class IIIb; Class IIIb recommendations; Class IIa; Class IIa recommendations; Class IIb; Class IIb recommendations; Class Ib; Class Ib recommendations; Class IlI; Class Ila; Class Ilb; Class Illa recommendations; Class Level; Class Level A; Class Level B; Class Level C; Class Level I; Class Level I C; Class Level III; Class Level III C; Class Level IIa; Class Level IIa B; Class Level IIa C; Class Level IIb; Class Level IIb B; Class Level IIb C; Class Level IIla; Class Level Ib; Class Level Reference; Class Level References; Class References; EAE recommendations; ESVS recommendations; EsVS recommendations; Evidence and Recommendations; Figure 1; Figure 10; Figure 12; Figure 13; Figure 6; Figure 9; Grade Level of evidence; Level A evidence; Level of Evidence A; Level of Evidence B; Level of Evidence C; Level of evidence A; Level of evidence B; Level of evidence C; Levels of evidence; NYHA Class IV; New Class III recommendations; RECOMMENDATIONS; Recommendation 100; Recommendation 109; Recommendation 111; Recommendation 112; Recommendation 113; Recommendation 114; Recommendation 115; Recommendation 117; Recommendation 120; Recommendation 121; Recommendation 122; Recommendation 13; Recommendation 131; Recommendation 135; Recommendation 139; Recommendation 141; Recommendation 142; Recommendation 143; Recommendation 146; Recommendation 15; Recommendation 158; Recommendation 16; Recommendation 17; Recommendation 18; Recommendation 19; Recommendation 21; Recommendation 22; Recommendation 23; Recommendation 25; Recommendation 35; Recommendation 36; Recommendation 37; Recommendation 38; Recommendation 40; Recommendation 42; Recommendation 44; Recommendation 45; Recommendation 46; Recommendation 49; Recommendation 52; Recommendation 56; Recommendation 57; Recommendation 6; Recommendation 60; Recommendation 64; Recommendation 65; Recommendation 67; Recommendation 7; Recommendation 74; Recommendation 75; Recommendation 76; Recommendation 79; Recommendation 81; Recommendation 87; Recommendation 90; Recommendation 91; Recommendation 97; Recommendations; Supplementary Table; Table; Table 17; Table 2; Table 3; Table 4; Table 5.3; Table 6; Table 9; Table A; Table of Evidence; Tables 1; Tables 2; Tables 3 and 4; Tables 6-8; Tables of Evidence; Treatment recommendations; acceptable; acceptable results; additional imaging recommendations; adjustable compression garments; anatomically suitable; anatomically suitable patients; antiplatelet tablets; antithrombotic recommendations; antithrombotic tablets; attributable; best practice recommendations; blood thinning tablets; class 4; class 5; class 6; class C; class D; class I; class IIa; class IIb; class Ila; class level; class level 1Ia; class level III; class level III B; class level IIa; class level IIa B; class level IIb B; class level Ila B; class level references; class of recommendation; class of recommendations; class reference; class references; class upgraded; clinical practice recommendations; clinically stable; consensus recommendations; correctable lesions; evidence level; evidence tables; evidence-based recommendations; figure caption; follow up recommendations; good practice recommendations; guideline recommendations; haemodynamically stable; haemodynamically stable patients; haemodynamically unstable; haemodynamically unstable patient; heart failure NYHA Class II; heritable conditions; heritable thrombophilia; imaging recommendations; level 1 evidence; level A evidence; level B and C evidence; level B evidence; level C evidence; level of evidence; level of evidence A; level of evidence B; level of evidence C; levels of evidence; low level evidence; low level of evidence; low-level evidence; management recommendations; multidisciplinary recommendations; neurologically unstable patients; new recommendations; non-reconstructable; physical activity recommendations; preventable cause; preventable costs; preventable death; recommendation; recommendation 102; recommendation 103; recommendation 105; recommendation 11; recommendation 115; recommendation 117; recommendation 118; recommendation 12; recommendation 126; recommendation 127; recommendation 13; recommendation 14; recommendation 15; recommendation 151; recommendation 18; recommendation 20; recommendation 21; recommendation 24; recommendation 26; recommendation 28; recommendation 29; recommendation 30; recommendation 31; recommendation 33; recommendation 34; recommendation 36; recommendation 37; recommendation 38; recommendation 39; recommendation 40; recommendation 42; recommendation 43; recommendation 44; recommendation 46a; recommendation 46b; recommendation 47; recommendation 48; recommendation 50; recommendation 53; recommendation 54; recommendation 56; recommendation 57; recommendation 66; recommendation 69; recommendation 72; recommendation 73; recommendation 75; recommendation 76; recommendation 8; recommendation 81; recommendation 83; recommendation 84; recommendation 88; recommendation 9; recommendation 90; recommendation 91; recommendation 94; recommendation 96; recommendation 98; recommendation grade; recommendation grading; recommendation grading system; recommendation levels; recommendations; recommendations criteria; research recommendations; screening recommendations; stable; stable cardiovascular disease; stable condition; stable coronary artery disease; stable non-intervened PAD; stable outpatients; stable retroperitoneal haematoma; strength of recommendation; subfigures; suitable anatomy; suitable vessels; summary table; table; treatment recommendation; treatment recommendations; unstable angina; unstable intubated patients; unstable retroperitoneal haematoma; unsuitable; Class of recommendation; Class of recommendations; Classes of Definition recommendation; Classes of recommendation; Classes of recommendations; Composite figure; ESC Recommendations; EULAR recommendations; Haemodynamically unstable patients; New Class I recommendations; New Class IIb recommendations; Recommendation 1; Recommendation 10; Recommendation 101; Recommendation 102; Recommendation 104; Recommendation 105; Recommendation 107; Recommendation 110; Recommendation 118; Recommendation 124; Recommendation 125; Recommendation 128; Recommendation 130; Recommendation 132; Recommendation 133; Recommendation 137; Recommendation 138; Recommendation 14; Recommendation 144; Recommendation 145; Recommendation 148; Recommendation 153; Recommendation 156; Recommendation 157; Recommendation 159; Recommendation 2; Recommendation 20; Recommendation 24; Recommendation 27; Recommendation 28; Recommendation 3; Recommendation 31; Recommendation 32; Recommendation 34; Recommendation 39; Recommendation 4; Recommendation 41; Recommendation 48; Recommendation 5; Recommendation 50; Recommendation 53; Recommendation 54; Recommendation 58; Recommendation 63; Recommendation 66; Recommendation 68; Recommendation 69; Recommendation 70; Recommendation 77; Recommendation 78; Recommendation 8; Recommendation 82; Recommendation 83; Recommendation 85; Recommendation 86; Recommendation 88; Recommendation 89; Recommendation 92; Rutherford class 4; SUMMARYOFRECOMMENDATIONS; classes of recommendations; recommendation 16; recommendation 49; recommendation 67,meta.guideline.recommendation
2017 ESC guidelines; 2017 guidelines; 2020 Clinical Practice Guidelines; 2021 AHA guidelines; 2023 ESVS Clinical Practice Guidelines; 2023 guidelines; 2024 Clinical Practice Guidelines; 2024 guidelines; 2025 guidelines; AGREE; AGREE II; AGREE II checklist; AGREE II reporting standards; AGREE II standards; AGREE Next Steps Consortium; AGREE NextSteps Consortium; AHA guidelines; Appraisal of Guidelines Research and Evaluation; CHEST Guideline; CONFLICT OF INTEREST; Clinical Practice Guideline; Clinical Practice Guidelines; Clinical guidelines; Conflict of Interest; Disclosures; Document Reviewers; Document reviewers; EANM guidelines; EANM procedural guideline; ESC Guidelines; ESC guidelines; ESC/ESVS 2017 Guidelines; ESVS; ESVS 2019 Clinical Practice Guidelines; ESVS 2020 Clinical Practice Guidelines; ESVS 2023; ESVS 2023 Carotid guidelines; ESVS AAA Guidelines Committee; ESVS Clinical Practice; ESVS Clinical Practice Guidelines; ESVS GC; ESVS GSC; ESVS Grade; ESVS Grade 1; ESVS Grade 1 injuries; ESVS Grade 2; ESVS Grade 2 injury; ESVS Grade 3; ESVS Grades; ESVS Guideline Steering Committee; ESVS Guidelines; ESVS Guidelines App; ESVS Guidelines Committee; ESVS Vascunet; ESVS clinical practice guidelines; ESVS grading system; ESVS guideline update policy; ESVS guidelines; ESVS website; ESVs; ESVs App; ESvS guidelines; EsVS; EsVS Grade 1; EsVS Grade 2; EsVS clinical practice guidelines; EsVs carotid guideline; EsvS Grade; EsvS Grade 2; EsvS Grade 3; EsvS Grade X; Esvs; Esvs Grade 1; Esvs Grade 1 or 2; Esvs Grade 2; Esvs Grade 3; Esvs Grade X; European Society for Vascular Surgery 2022 guidelines; Evidence-Based Clinical Practice Guidelines; GUIDELINE; Global Vascular Guidelines; Guideline; Guideline Committee; Guideline Development; Guideline Steering Committee; Guideline Writing Committee; Guidelines; Guidelines Committee; Guidelines Production; Guidelines Writing Committee; Guidelines-development; NiCE guidelines; PAD guidelines; PAD guidelines 2024; Practice Guidelines; Practice guidelines; SVS BTAl guidelines; SVS Lower Extremity Guidelines Committee; SVS guidelines; USPSTF guidelines; Vascular Guidelines; Writing Committee; Writing committee; all guidelines; author disclosure grid; bilateral EsvS Grade; clinical guideline 144; clinical guideline 89; clinical guidelines; clinical practice guideline; clinical practice guidelines; clinical practice guidelines.; comprehensive guidelines; consensual agreement; conservative guidelines; current guidelines; disclosure; disclosure statements; disclosure timing; document reviewers; draft guideline; efficacy guidelines; evidence-based guidelines; full disclosure; general agreement; guideline; guideline authors; guideline classifications; guideline developers; guideline development; guideline development scheme; guideline document; guideline draft; guideline implementation; guideline panels; guideline process; guideline recommended therapies; guideline recommended therapy; guideline reviewers; guideline summary documents; guideline writing committee; guideline-recommended therapy; guideline_upHD_PD_VA; guidelines; guidelines document; guidelines production; guidelines writing group; guías ESVS 2017; guías ESVS 2023; healthcare guidelines; intensive guidelines; international guidelines; interobserver agreement; management guidelines; medical guidelines; penetrating Esvs; practice guidelines; practice management guideline; procedure guidelines; quality improvement guidelines; revise guidelines; standardised guidelines; therapy guidelines; treatment guidelines; 2017 ESC Guidelines; 2022 ESC guidelines; AGREE Reporting Checklist; AGREE reporting checklist; AGREE reporting standards; AHA/ACC Guideline; CLINICAL PRACTICE GUIDELINE; Chronic Venous Disease Guidelines; Clinical practice guidelines; ESCMID guidelines; ESO guideline; ESUR Guidelines; ESVM Guideline; ESVS Description Grade; ESVSGuidelineCommittee; European guideline; GRADE guidelines; Global vascular guidelines; Ill.Disclosure Categories; NICE clinical guideline; NICE guidelines; conflict of interest policy; writing committee,meta.guideline.document
AVF; AVF aneurysms; AVF creation; AVF failure; AVF formation; AVF function; AVF maturation; AVF outcome; AVF patency; AVF patency rates; AVF recirculation; AVF thrombosis; HD-AVF/AVG; asymptomatic AVF; autogenous AVF; brachiobasilic AVF; brachiocephalic AVF; early AVF thrombosis; primary AVF patency; pulsatile AVF; radiocephalic AVF,anatomy.access.avf
AVG; AVG anastomotic stenosis; AVG failure; AVG infection; AVG infections; AVG insertion; AVG patency; AVG thrombosis; prosthetic AVG,anatomy.access.avg
CVC; CVC absent; CVC for HD; CVC insertion site; CVC management; CVC present; CVC removal; CVC use; HD-CVC; non-tunnelled CVC; tunnelled CVC; type of CVC,anatomy.access.cvc
Arteriovenous Vascular Access; Catheter Cardiovasc Interv; Catheter directed thrombolysis; Catheter dysfunction; Catheter related bacteraemia; Central venous catheter; Diagnostic catheter angiography; Fogarty catheter; HeRo catheter; Hemodialysis access; Late vascular access complications; Non-used vascular access; PTA Balloon Catheter; Primary vascular access; RFA catheter; Vascular Access; Vascular Access Society; Vascular access; autogenous vascular access; balloon-catheter; catheter; catheter angiography; catheter based; catheter directed foam sclerotherapy; catheter directed therapy; catheter directed thrombolysis; catheter occlusion; catheter related thrombosis; catheter removal; catheter-based continuous wound analgesia; catheter-based interventions; catheter-directed thrombolysis; catheter-related thrombosis; central venous catheter; drainage catheter; early vascular access; functioning vascular access; guiding catheter; hemodialysis; hemodialysis access; inadequate vascular access; indwelling central venous catheter; invasive catheter; linear forearm hemodialysis access; lower limb vascular access; maintenance hemodialysis; nitinol reinforced silicone catheter; percutaneous catheter placement; peripherally inserted central venous catheter; peritoneal dialysis catheter; permanent catheter; pigtail catheter; prosthetic vascular access; tertiary vascular access; thrombectomy catheter; type of vascular access; underlying vascular access stenosis; upper arm vascular access; vascular access; vascular access aneurysms; vascular access creation; vascular access dysfunction; vascular access ligation; vascular access modality; vascular access outcomes; vascular access related complications; vascular access stenosis; vascular access surgery; vascular access techniques; vascular access type; Hemodialysis; Vascular access nurse; autogenous hemodialysis access; catheter related deep vein thrombosis; early limb threatening vascular access; intraoperative catheter; pharmacomechanical catheter directed thrombolysis; vascular access closure; vascular access complications; vascular access failure; vascular access induced; vascular access nurse; vascular access nurses; vascular access salvage; vascular access surveillance; vascular access training programs,anatomy.access.general
AAA; AAA US measurement; AAA detection rate; AAA growth; AAA growth rate; AAA infrarrenal; AAA management; AAA prevalence; AAA related death; AAA related morphological abnormalities; AAA repair; AAA repairs; AAA screening; AAA size; Abdominal Aortic Aneurysm; Abdominal aortic aneurysm; Aortic aneurysm; Descending thoracic aortic aneurysm; Infrarenal abdominal aortic aneurysm repair; TAAA; TAAA repair; Thoracic aortic aneurysm; abdominal aorta aneurysm; abdominal aortic aneurysm; abdominal aortic aneurysm repair; abdominal aortic aneurysm screening; aortic aneurysm; aortic aneurysm repair; aortic root aneurysm; asymptomatic AAA; complex AAA; complex AAA repair; complex abdominal aortic aneurysm; degenerative aortic aneurysm; descending aortic aneurysm repair; elective AAA repair; elective TAAA; elective abdominal aortic aneurysm; elective abdominal aortic aneurysm repair; elective endovascular abdominal aortic aneurysm repair; emergency complex AAA repair; endovascular abdominal aortic aneurysm; endovascular abdominal aortic aneurysm repair; endovascular aortic aneurysm repair; familial thoracic aortic aneurysm; heritability of AAA; inflammatory AAA; inflammatory abdominal aortic aneurysm; juxtarenal AAA; mycotic AAA; mycotic abdominal aortic aneurysm; non-shrinking AAA; open AAA repair; open AAA repairs; open abdominal aortic aneurysm repair; pararenal AAA; reparación de AAA; ruptured abdominal aortic aneurysm; ruptured complex AAA; saccular AAA; small AAA; standard AAA; standard fusiform abdominal aortic aneurysm; suprarenal AAA; symptomatic AAA; thoracic aortic aneurysm; thoracic endovascular aortic aneurysm repair; thoraco-abdominal aortic aneurysm; thoracoabdominal aortic aneurysm; thoracoabdominal aortic aneurysm repair; Ø max AAA; AAA surgery; Elective abdominal aortic aneurysm repair; Endovascular abdominal aortic aneurysm repair; Laparoscopic abdominal aortic aneurysm repair; Ruptured complex abdominal aortic aneurysm; Short neck infrarenal AAA; asymptomatic abdominal aortic aneurysm; inflammatory AAA rupture; non-ruptured AAA; ruptured complex abdominal aortic aneurysm; ruptured descending thoracic aortic aneurysm; symptomatic non-ruptured abdominal aortic aneurysm,anatomy.aorta.aneurysm
AORTA trial; AORTIC DISEASE; Abdominal aortic aneurysms; Acute Aortic Syndromes; Acute aortic occlusion; Aorta; Aorta abnormalities; Aorta diseases; Aorta disorders; Aortic; Aortic Arch; Aortic arch; Aortic coarctation; Aortic disease; Aortic graft; Aortic injury; Aortic isthmus; Aortic management; Aortic team; Blunt thoracic aortic injury; Blunt traumatic thoracic aortic injury; Descending Thoracic Aorta; Descending thoracic aorta; Familial thoracic aortic disease; German Aortic Centre; Penetrating aortic ulcer; Ruptured thoracic aortic aneurysms; SUPRA-AORTIC BRANCHES; Shaggy aorta; THORACIC AORTIC MEDICINE; Thoracic Aortic Injury; Thoracic aortic aneurysms; Thoracic aortic injury; Thoracic aortic pathologies; Thoracic aortic rupture; Thoraco-abdominal aorta; abdominal aorta; abdominal aortic; abdominal aortic VG removal; abdominal aortic VGEl; abdominal aortic VGl; abdominal aortic aneurysms; abdominal aortic diameter measurement; abdominal aortic dissections; abdominal aortic graft; abdominal aortic graft infection; abdominal aortic injuries; abdominal aortic injury; abdominal aortic surgery; abnormal aortic wall; acoabdominal aortic aneurysms; acute aortic intramural hematoma; acute aortic occlusion; acute aortic syndrome; acute aortic syndromes; aorta; aorta diagram; aorta related haemorrhage; aorta-SMA distance; aortic; aortic GEF; aortic IMH; aortic VGEl; aortic abdominal graft; aortic anastomoses; aortic anatomy; aortic aneurysms; aortic angiosarcoma; aortic arch; aortic arch aneurysms; aortic arch angulation; aortic arch disease; aortic arch graft; aortic arch involvement; aortic arch pathologies; aortic arch pathology; aortic arch procedures; aortic arch programs; aortic arch replacement; aortic arch surgery; aortic atheroma; aortic axis; aortic balloon occlusion; aortic bifurcation; aortic clamping; aortic clamping zone; aortic coarctation; aortic complications; aortic contour abnormalities; aortic coverage; aortic cross-clamping; aortic diameter; aortic diameter measurements; aortic dilatation; aortic dilation; aortic disease; aortic diseases; aortic disorder; aortic dissections; aortic endograft; aortic endograft infection; aortic endografts; aortic enlargement; aortic flow gradients; aortic graft; aortic graft healing; aortic graft infection; aortic graft infections; aortic graft replacement; aortic grafts; aortic growth; aortic growth rate; aortic growth rates; aortic imaging; aortic injuries; aortic injury; aortic interposition graft; aortic involvement; aortic isthmus; aortic lumen; aortic morbidity; aortic neck dilatation; aortic occlusion; aortic occlusion balloon; aortic occlusion time; aortic operations; aortic pathologies; aortic pathology; aortic practice; aortic pressure; aortic prosthesis; aortic pseudoaneurysm; aortic re-intervention; aortic reference diameters; aortic regurgitation; aortic related complications; aortic related death; aortic related events; aortic related mortality; aortic remodelling; aortic root; aortic root replacement; aortic rupture; aortic segments; aortic services; aortic stentgraft relining; aortic stump; aortic surgeons; aortic surgery; aortic team; aortic thrombus; aortic tube; aortic ulcer; aortic valve disease; aortic valve pathology; aortic valve regurgitation; aortic valve stenosis; aortic wall; aortic/iliac conduit graft; ascending aorta; ascending aorta rupture; ascending aortic; bicuspid aortic valve; blunt abdominal aortic injuries; blunt abdominal aortic injury; blunt minor abdominal aortic injuries; blunt occlusive aortic trauma; blunt thoracic aortic injury; blunt traumatic aortic injury; blunt traumatic thoracic aortic injuries; catheter aortic valve implantation; central aortic pressure; complex abdominal aortic aneurysms; complex aortic pathologies; congenital aortic valve malformation; coral reef aorta; cryopreserved aortic allografts; cryopreserved aortic homografts; descending aorta; descending aorta surgery; descending aortic operations; descending thoracic aorta; descending thoracic aorta aneurysms; descending thoracic aortic; descending thoracic aortic diameter; descending thoracic aortic disease; descending thoracic aortic graft; descending thoracic aortic pathology; dissected aorta; distal aortic arch; distal aortic perfusion; distal thoracic aorta; elective abdominal aortic aneurysms; entire aorta; extensive ascending aortic length; extensive thoracic aorta coverage; floating aortic arch thrombi; healthy infrarenal aorta; high risk aortic features; in situ aortic allograft replacement; infected aortic EG; infected aortic endograft; infected aortic endografts; infected aortic graft; inflammatory aortic aneurysms; infrarenal aorta; infrarenal aortic segment; intra-aortic balloon; intra-aortic balloon pump; isolated aortic arch aneurysms; isolated aortic graft; large peri-aortic haematoma; major supra-aortic branches; management of aortic graft infections; mechanical aortic valve replacement; minimal aortic injuries; minimal aortic injury; multidisciplinary aortic team; mycotic aortic aneurysms; native aortic arch; native aortic tissue; native ascending aorta; native thoracic aortic coarctation; patent aortic side branches; penetrating abdominal aortic injury; penetrating aortic ulcer; penetrating aortic ulcers; penetrating thoracic aortic injury; peri-aortic fibrosis; peri-aortic infection; peri-aortic inflammation; perpendicular to the aorta; prevent aortic graft infection; prosthetic ascending aorta; proximal aortic neck anatomy; reddish-brown aorta; renal-aortic PSV ratio; right aortic arch; ruptured abdominal aortic aneurysms; ruptured thoracic aortic aneurysms; saccular abdominal aortic aneurysms; small abdominal aortic aneurysms; sub-aneurysmal aorta; sub-aneurysmal aortic diameters; supra aortic trunks; supra-aortic branches; supra-aortic disease; supra-aortic trunk; supra-aortic vessel; supra-aortic vessels; supra-coeliac aorta; supracoeliac abdominal aorta; supracoeliac aorta; thoracic aorta; thoracic aortic; thoracic aortic VGEl; thoracic aortic aneurysms; thoracic aortic approaches; thoracic aortic arch; thoracic aortic disease; thoracic aortic diseases; thoracic aortic dissections; thoracic aortic endografting; thoracic aortic injury; thoracic aortic lesions; thoracic aortic pathology; thoracic aortic resections; thoracic aortic surgery; thoracic aortic surgery program; thoracic aortic surgical procedures; thoracic aortic transection; thoracic aortic wall; thoraco-abdominal aorta; thoraco-abdominal aortic; thoraco-abdominal aortic disease; thoracoabdominal aorta; thoracoabdominal aortic aneurysms; thoracoabdominal aortic approaches; thoracoabdominal aortic resections; total aortic arch replacement; transcatheter aortic valve implantation; transcatheter aortic valve replacement; traumatic aortic injury; traumatic aortic rupture; traumatic aortic transection; traumatic thoracic aortic injuries; type I aortic arch; type II aortic arch; type III aortic arch; uncomplicated penetrating aortic ulcer; ventral aorta; ACUTE AORTIC OCCLUSION; Abdominal aorta; Abdominal aortic VGEI; Acute aortic syndrome; Acute thoracic aortic syndrome; Aortic arch replacement; Aortic arch surgery; Aortic diameter; Aortic diameter measurement; Aortic intramural haematoma; Aortic morphology; Aortic prosthetic graft infections; Aortic tumours; Bovine aortic arch; Descending aortic diameter; Descending thoracic aortic aneurysms; Familial thoracic aortic aneurysms; Penetrating thoracic aortic injury; Supra-aortic Trunks; Thoracic Aortic Disorders; Thoracic aortic VGEI; abdominal aortic vascular graft; active distal aortic perfusion; aortic arch diseases; aortic intramural hematoma; aortic stentgraft; aortic tumours; blunt traumatic thoracic aortic injury; coarctation of the aorta; descending thoracic aortic aneurysms; familial thoracic aortic disease; infected abdominal aortic endograft; mycotic abdominal aortic aneurysms; predissection aortic size; prosthetic aortic graft infections; severe aortic injury; supra-aortic trunks; symptomatic inflammatory abdominal aortic aneurysms; thoracic aortic rupture; thoraco-abdominal aortic aneurysms; transverse aortic arch; traumatic thoracic aorta injury,anatomy.aorta.disease
